family,evidence_status,actually_varied,held_fixed,measured,not_identified,source_script,result_artifact,replication_count,interpretation_boundary,inventory_ids
"Panel length, N, and burn-in",existing result; plus declared output missing,"In the retained eight-model grid, T = 10, 20, 30, 50, 100 and rho_Z = 0.50, 0.85.",The retained T grid fixes N = 100 and burn-in = 100; it is not an N or burn-in sensitivity analysis.,Bias and MCSE by T for eight estimators; |bias(ADL+FE+lagged Z)| = 0.003 to 0.014.,"No result identifies robustness to N or burn-in changes, arbitrary short panels, or a general finite-T correction. The separate 200-rep T script declares an output but has no versioned CSV.",simulations/dual_role_z/sim_dual_role_z_varyT_8models.R; simulations/dual_role_z/sim_dual_role_z_varyT.R (missing output),simulations/dual_role_z/results/sim_dual_role_z_varyT_8models_results.csv; sim_dual_role_z_varyT_results.csv is absent,500 per retained scenario,"Figure 2's T = 30 result is conditional on its fixed N, burn-in, DGP, and estimator set; it is not evidence that dynamic FE is generally free of finite-T bias.",dual_role_varyT_8models; dual_role_varyT (declared output missing)
Binary and staggered absorbing treatment,existing result,"Switcher/never-treated shares, onset times, collider channels, outcome persistence, and rho_Z in binary dynamic and absorbing-staggered DGPs.","Dynamic binary designs retain a linear homogeneous CET (beta = 1), short panel windows, and their stated lag structure; treatment is exogenous in mechC_adl.",Bias/RMSE/MCSE by specification. mechC_adl has 48 retained scenarios; absorbing design has 24.,"No result identifies effects for non-absorbing treatment paths, anticipation, treatment-effect heterogeneity, regime effects, or arbitrary adoption processes.",simulations/v4_mechanisms/sim_mechC_adl.R; simulations/dynamics/sim_staggered_posttreat.R,simulations/v4_mechanisms/results/sim_mechC_adl_results.csv; simulations/dynamics/results/sim_staggered_posttreat_results.csv,500 per retained scenario in each cited dynamic result CSV,"These are design-specific CET comparisons under stated adoption clocks; they do not validate a general DID, event-study, or treatment-regime estimator.",mechC_adl; staggered_posttreat
Nonlinear treatment and covariate response,existing result,"Specified quadratic, cubic, logarithmic, sinusoidal, interaction, nonlinear carryover, and level-dependent-trend forms and strengths.","Most nonlinear designs fix N = 100, T = 30, burn-in = 100, linear CET beta = 1, and the remaining dynamic parameters; the collider grid also includes T = 10, 30.","Bias, RMSE, MCSE, and discarded draws. Persisted replications: collider (requested 500; persisted 76--500 per scenario), interaction (500 per retained scenario), carryover (requested 500; persisted 445--500 per scenario); stable Callaway grid max |ADL(all) bias| = 0.000 to 0.004.","No result identifies arbitrary nonlinear links, untested interactions, nonlinear outcome models, or general causal effects outside the named DGPs.",simulations/nonlinearity/sim_nl_collider.R; sim_nl_interact.R; sim_nl_carryover.R; simulations/dynamics/sim_callaway_controls.R,simulations/nonlinearity/results/sim_nl_*_results.csv; simulations/dynamics/results/sim_callaway_controls_results.csv,collider requested 500; persisted 76--500 per scenario ; interaction 500 per retained scenario ; carryover requested 500; persisted 445--500 per scenario,The results test only named stable functional forms and a linear CET target; they bound neither unknown nonlinearities nor link-function misspecification generally.,nl_collider; nl_interact; nl_carryover; callaway_controls
Measurement error in the observed control,existing result,"Classical measurement-error variance in observed Z: sigma^2_me = 0, 0.5, 1, 2, with collider-channel strengths.","N = 200, T = 30, beta = 1, no burn-in, and a static TWFE collider DGP are fixed in the legacy v4 mechanism-D artifact.","FWL shift, coefficient bias, RMSE, and coverage; |long-model bias| = 0.058 to 0.530.","No result identifies the latent true Z, corrects measurement error, or validates the specification-shift interpretation when measurement reliability is unknown.",simulations/v4_mechanisms/sim_ivb_twfe_v4.R (mechanism D),simulations/v4_mechanisms/results/sim_ivb_twfe_v4_mechD.csv,500 per scenario (legacy v4 CSV),Measurement error changes the observed projection and attenuation pattern; it does not turn the observed shift into a causal estimate or supply reliability correction.,v4_mechD
Lagged feedback from outcome to treatment,existing result,Lagged feedback phi from Y_(t-1) to D_t and rho_Z; related direct-feedback and feedback-plus-carryover designs vary their documented grids.,"N = 100, T = 30, burn-in = 100, beta = 1, and the stated dual-role channels are fixed; feedback is lagged, not contemporaneous.","Bias, RMSE, MCSE, stability/discard records, and FWL quantities. Retained Y-to-D rows: 7; 500 per retained scenario.","No result covers contemporaneous Y_t-to-D_t feedback, all feedback lags, or a causal estimator without sequential exchangeability and sufficient observed history.",simulations/dynamics/sim_feedback_Y_to_D.R; sim_direct_feedback.R; sim_feedback_carryover.R,simulations/dynamics/results/sim_feedback_Y_to_D_results.csv; sim_direct_feedback_results.csv; sim_feedback_carryover_results.csv,Y-to-D 500 per retained scenario ; direct-feedback 500 per retained scenario ; feedback-carryover 500 per retained scenario,"Lagged feedback can be studied only within the stated stable grid; the conditional baseline still requires a defended causal clock, history, and exchangeability.",feedback_Y_to_D; direct_feedback; feedback_carryover
Carryover and lag specification,existing result,"Linear beta_2, nonlinear carryover form/strength, and rho_Z; combined design also varies feedback phi.","N = 100, T = 30, burn-in = 100, beta = 1, and the stated dual-role channels are fixed in the direct/nonlinear designs.","Bias, RMSE, MCSE, estimated lag coefficient, and stability/discard records. Direct carryover: 500 per retained scenario; feedback-carryover: 500 per retained scenario.","No result identifies cumulative/long-run effects when the lag structure is wrong, or establishes that a single-lag ADL is adequate in other DGPs.",simulations/dynamics/sim_direct_carryover.R; sim_feedback_carryover.R; simulations/nonlinearity/sim_nl_carryover.R,simulations/dynamics/results/sim_direct_carryover_results.csv; sim_feedback_carryover_results.csv; simulations/nonlinearity/results/sim_nl_carryover_results.csv,direct 500 per retained scenario ; nonlinear requested 500; persisted 445--500 per scenario ; feedback-carryover 500 per retained scenario,"Correctly representing the relevant history is a scope condition. If the target is cumulative or the lag order is wrong, the reported coefficient can answer a different question.",direct_carryover; feedback_carryover; nl_carryover
Contemporaneous unobserved confounding,existing result,"Current confounding strength kappa, persistence phi_U, rho_Z, and the U-to-Z channel delta_U.","N = 100, T = 30, burn-in = 100, beta = 1, and the specified linear dynamic structure are fixed.","Bias/RMSE/MCSE for observed-history specifications and an oracle observing U_t; with kappa > 0, |ADL(all) bias| = 0.079 to 0.526 and oracle |bias| = 0.000 to 0.003.","No observed-history specification identifies the CET with an omitted current common cause; the oracle is a DGP benchmark, not an empirical remedy.",simulations/dynamics/sim_persistent_confounder.R,simulations/dynamics/results/sim_persistent_confounder_results.csv,500 per retained scenario,"The observed-history ADL baseline does not solve contemporaneous unobserved confounding; an additional design, measurement, or assumption is required.",persistent_unobserved
